<!ELEMENT entry (entry*)>
<!ATTLIST entry args CDATA #REQUIRED>
<!ATTLIST entry className CDATA #REQUIRED>
<!ATTLIST entry methodName CDATA #REQUIRED>
<!ATTLIST entry calledByClass CDATA #REQUIRED>
<!ATTLIST entry calledByMethod CDATA  #REQUIRED>
<!ATTLIST entry calledByObject CDATA  #REQUIRED>
<!ATTLIST entry thisObject CDATA #REQUIRED>
<!ATTLIST entry nextCallInSubtree CDATA #REQUIRED>
<!ATTLIST entry nextCallInOrder CDATA #REQUIRED>
<!ATTLIST entry quantifier CDATA #REQUIRED>